{
  "$schema": "./registry.config.schema.json",
  "scope": "example",
  "npmRegistry": "https://registry.npmjs.org",
  "templateVersion": "0.5.1",
  "site": {
    "title": "Example Component Registry",
    "description": "A component registry that stays in git: docs from source, live examples, versions via Changesets.",
    "primaryColor": "#6750a4",
    "links": [
      {
        "label": "GitHub",
        "href": "https://github.com/behivetech/bht-component-registry"
      }
    ]
  }
}
